{
 "x-document": {
  "doc_id": "TEACH-PROP-DCS-01-DATA",
  "class": "decision-table",
  "version": "0.3.0",
  "status": "proposed",
  "owner": "Patrick Craven, Top Shelf Service LLC",
  "created_on": "2026-10-05",
  "updated_on": "2026-10-05"
 },
 "baseline": {
  "repo": "peteywee/teach-v2",
  "ref": "main",
  "commit": "6553eb465e469dc9e60368cde40d259f86262997"
 },
 "classification_baseline": "2b5714d8d850da7a47c1666da5a2c7974cabe40f",
 "owner_decision": {
  "approved_in_chat": "2026-10-05T04:05-05:00",
  "scope": "decision sheet A-D",
  "registration": "PENDING under issue #75"
 },
 "derived_from": {
  "inventory_script": "scripts/verification/owner-decision-inventory.mjs#deriveOwnerDecisionInventory",
  "answer_register": "verification/owner-decisions/2026-10-05/answer-register.json",
  "answer_register_sha256": "996fa46fbc4e4891c349f4453e4f576868833a6d00e4aff645ee7cf6b83791f8",
  "contract_sha256": {
   "contracts/c00-system-authority-contract.md": "63500932db774880d5769f545887a21c2482961e405eee328aed2cc25fa4b661",
   "contracts/c01-canonical-semantics-contract.md": "e407a52b739756e84264a66ef0a824d02435e4ee15e938c405c4caf8dc1ebd40",
   "contracts/c02-automation-agent-authority-contract.md": "21202fef396b5179a718ded8fa2f28a4726497c393ce083fb7af5297f594de23",
   "contracts/c11-identity-credentials-contract.md": "3240ae5ccb81fe1233f74e52c8f7bb63caf55bd5958a87506948e09bec95a0c6",
   "contracts/c12-application-sessions-contract.md": "6bfda46131be1c25d3aa71f5a771dcc1374033156b2467757c3dacdee527481d",
   "contracts/c13-tenancy-membership-contract.md": "e52371e79cf0619eac158d58785b6d5005dbd9a3381e3e5037fb0016255dbf6e",
   "contracts/c14-authorization-capabilities-contract.md": "67c3f8820c5f4bc6d3e74f4601f079ef9202750ce7e4b48e6338d3b60c4b6fd3",
   "contracts/c15-data-isolation-privacy-contract.md": "e14300a57e8bf75f39509efa5c11c6ae994dba9dd798336f01d23cce8c70e84e",
   "contracts/c21-database-migration-contract.md": "eb64b82349abda75370ab68961af92094e6840a3d02e18a1bfb2f4eaaac6a135",
   "contracts/c22-transaction-idempotency-reconciliation-contract.md": "41b6d408d3a90175119b6b47574a186564735d27721ea800e4bfc6c48d0a6f0e",
   "contracts/c23-audit-lifecycle-events-contract.md": "707651e689e57e779672cd88bf64fb76253801b1c468c5b1d171790c66415ebb",
   "contracts/c31-content-teaching-engine-contract.md": "d4fb182c07c50a56841f0c2b80d368bc3641f7df68ad8cc824b1141137819583",
   "contracts/c32-learning-sessions-progress-contract.md": "61ed20459d1e1ba0cac624e13227aac7c2915e71b8e4c0ed0b4f1fedda41821d",
   "contracts/c33-manager-operations-contract.md": "c52d29bd315d302cb3a9a749eabd354e1b741a3a4514e2c98aac30497fc363f9",
   "contracts/c34-certification-credentials-contract.md": "ee6ce0685f0a47a0d050989ff43e969b78eddd6c08619dc8185ef7ea531e8c7d",
   "contracts/c41-api-boundary-contract.md": "59257d21573369827d0bed24919e7d6fedec5221c780ffeb404dcea68fb26e52",
   "contracts/c42-web-client-boundary-contract.md": "5655dc089faf29bc8db16fd81319fcad6a7b37b8c5833b1b5d0fdb8b97ce9e28",
   "contracts/c51-verification-evidence-contract.md": "7390163d21ef0d00a8c7190108fa2f1e5ab1dd28e0d18569dc8e823fe8cf0161",
   "contracts/c52-deployment-release-recovery-contract.md": "a1a3a4637366cff364c825cd4a703518b73ada649f9f6f5657ca966adb092584",
   "contracts/c53-observability-contract.md": "1ac78f4cc861ce5a467ff8bea4eb8a2be4a2b7d2acff68ac53c41b08af64d209",
   "contracts/c61-analytics-contract.md": "aad01e1353076e78e3e5bc6e342919ef7f9e4c4dc2da20b5b0809ae1ecad9fe2",
   "contracts/c62-pwa-offline-contract.md": "891fb6513da8c8efb529f023f149153e8ed90e0d7ac9aa46af78f68f61ff8ce6",
   "contracts/c63-billing-contract.md": "b01c3bf281cc0883e50cf74b9c52677fee1cc5b3ede422e5e015c58c5cfa0b9c"
  }
 },
 "policy_or_runtime_authority_changed": false,
 "owner_approval_recorded": false,
 "totals": {
  "rows": 56,
  "live_unresolved": 49,
  "registered_since_classification": 7,
  "explicit_blockers": 11,
  "by_closure_class": {
   "CONFIRM_RECOMMENDATION": 3,
   "READY_TO_REGISTER": 13,
   "RECONCILE_DRAFT": 3,
   "REGISTER_AS_DISABLED": 10,
   "REGISTER_SPLIT_RESIDUAL": 6,
   "REGISTER_WITH_ARTIFACT": 12,
   "UNKNOWN_OWNER_VALUE": 2
  },
  "explicit_blockers_by_closure_class": {
   "CONFIRM_RECOMMENDATION": 2,
   "READY_TO_REGISTER": 1,
   "RECONCILE_DRAFT": 3,
   "REGISTER_WITH_ARTIFACT": 4,
   "UNKNOWN_OWNER_VALUE": 1
  },
  "rows_with_missing_owner_values": 9
 },
 "rows": [
  {
   "id": "OQ-SYS-1",
   "live_state": "UNRESOLVED",
   "registered_by": null,
   "contract": "contracts/c00-system-authority-contract.md",
   "contract_version_live": "1.0.3",
   "explicit_blocker": false,
   "affects": "SYS-4",
   "question": "Does numeric order within a group (for example C11 before C12) define precedence, or are contracts within a group peers?",
   "answer_register": {
    "path": "verification/owner-decisions/2026-10-05/answer-register.json",
    "record_index": 57,
    "capture_state": "ANSWER_RECEIVED_UNREGISTERED",
    "recorded_detail_state": "SUPPLIED_PACKET_RESPONSE",
    "packet_answer_sha256": "dec29d4a87e3e5d25d27bd294a6660e3cc9120c6dbdf24d1a370e1c662c07287",
    "follow_up_sha256": null
   },
   "preserved_value": {
    "intra_group_precedence": "PEERS",
    "conflict_rule": "MORE_RESTRICTIVE_REQUIREMENT_APPLIES",
    "conflict_must_be_recorded": true
   },
   "closure_class": "READY_TO_REGISTER",
   "owner_action": "APPROVE_REGISTRATION",
   "repeat_original_question": false,
   "controlling_artifact": "governance/proposals/2026-10-05-decision-closure/09-governance-content-certification-web-packet.md",
   "missing_owner_values": [],
   "dependencies": [],
   "conflicts": [],
   "technical_notes": [],
   "registration_target": {
    "contract": "contracts/c00-system-authority-contract.md",
    "from_version": "1.0.3",
    "bump": "MINOR",
    "procedure": "SYS-21",
    "requirement_amended": "SYS-4"
   },
   "evidence_required_to_mark_resolved": [
    "GitHub issue opened before material contract edits (SYS-21)",
    "Prior contract version preserved under contracts/superseded/ with status superseded",
    "OQ row marked Resolved with the selection token and approval date; affected requirement text carries the value",
    "contracts/APPROVAL-RECORD.md entry naming contract ID and new version, recorded from an owner approval (SYS-17, SYS-18)",
    "scripts/verification/owner-decision-inventory.mjs unresolved count decreases by exactly the resolved IDs and no others",
    "scripts/docs/validate-document-metadata.mjs and existing CI pass on the exact registration SHA"
   ],
   "implementation_evidence_is_separate": true,
   "semantic_assertions": [
    {
     "path": "governance/proposals/2026-10-05-decision-closure/09-governance-content-certification-web-packet.md",
     "contains": [
      "GROUP_PEERS_RESTRICTIVE_ON_CONFLICT",
      "the more restrictive requirement governs"
     ],
     "must_not_contain": []
    }
   ],
   "state": "PROPOSED"
  },
  {
   "id": "OQ-SYS-2",
   "live_state": "UNRESOLVED",
   "registered_by": null,
   "contract": "contracts/c00-system-authority-contract.md",
   "contract_version_live": "1.0.3",
   "explicit_blocker": false,
   "affects": "SYS-11",
   "question": "Where does the compatibility register live, and in what format (Markdown table, machine-readable file checked in CI, or both)?",
   "answer_register": {
    "path": "verification/owner-decisions/2026-10-05/answer-register.json",
    "record_index": 58,
    "capture_state": "ANSWER_RECEIVED_UNREGISTERED",
    "recorded_detail_state": "SUPPLIED_PACKET_RESPONSE",
    "packet_answer_sha256": "198a6bc0f1c663d6a54335bc3ffebfffdf831ed83ac91bcbec2f380edf074244",
    "follow_up_sha256": null
   },
   "preserved_value": {
    "canonical_register": "governance/compatibility-register.json",
    "human_view": "generated Markdown",
    "ci_validated": true
   },
   "closure_class": "REGISTER_WITH_ARTIFACT",
   "owner_action": "APPROVE_ARTIFACT_AND_REGISTRATION",
   "repeat_original_question": false,
   "controlling_artifact": "governance/proposals/2026-10-05-decision-closure/09-governance-content-certification-web-packet.md",
   "missing_owner_values": [],
   "dependencies": [],
   "conflicts": [],
   "technical_notes": [
    "Register file does not exist at baseline; artifact defines its JSON Schema, generator and CI check."
   ],
   "registration_target": {
    "contract": "contracts/c00-system-authority-contract.md",
    "from_version": "1.0.3",
    "bump": "MINOR",
    "procedure": "SYS-21",
    "requirement_amended": "SYS-11"
   },
   "evidence_required_to_mark_resolved": [
    "GitHub issue opened before material contract edits (SYS-21)",
    "Prior contract version preserved under contracts/superseded/ with status superseded",
    "OQ row marked Resolved with the selection token and approval date; affected requirement text carries the value",
    "contracts/APPROVAL-RECORD.md entry naming contract ID and new version, recorded from an owner approval (SYS-17, SYS-18)",
    "scripts/verification/owner-decision-inventory.mjs unresolved count decreases by exactly the resolved IDs and no others",
    "scripts/docs/validate-document-metadata.mjs and existing CI pass on the exact registration SHA"
   ],
   "implementation_evidence_is_separate": true,
   "semantic_assertions": [
    {
     "path": "governance/proposals/2026-10-05-decision-closure/09-governance-content-certification-web-packet.md",
     "contains": [
      "JSON_CANONICAL_REGISTER_WITH_MARKDOWN_VIEW",
      "governance/compatibility-register.json"
     ],
     "must_not_contain": []
    }
   ],
   "state": "PROPOSED"
  },
  {
   "id": "OQ-SYS-5",
   "live_state": "UNRESOLVED",
   "registered_by": null,
   "contract": "contracts/c00-system-authority-contract.md",
   "contract_version_live": "1.0.3",
   "explicit_blocker": false,
   "affects": "SYS-29",
   "question": "Which parts of C11–C15 and C21–C23 are applicable to the learner demo?",
   "answer_register": {